[
 {
  "schema_version": "1.0.0",
  "review_id": "R7B-SSCTR-FIDELITY",
  "review_revision": "R7B1-SSCTR-r2",
  "review_date": "2026-10-31",
  "agent_version": "SSCTR-1.0.0",
  "constitution_revision": "SSCTR-CONST-1.0.0",
  "protocol_revision": "SSCTR-EP-1.0.0",
  "reviewer": {
   "actor_type": "AI_AGENT",
   "instance_id": "ssctr-r7b1-2026-10-31, the same SSCTR instance that wrote R7B1-SSCTR-r1, running the one narrow recheck the loop bound allows; its instructions match the body of the project adapter .claude/agents/sports-science-concurrent-training-reviewer.md (file SHA-256 021b59519c9df2a95fbca91cd553a5cdc2b1ce3719d2364ed431ef3fa8c6c52d), which loads CONSTITUTION SSCTR-CONST-1.0.0 and skill sports-science-review 1.0.0; model inherited (claude-opus-5-5); no Agent tool. Not the author of the R7-B.1 runtime, its correction cycle, tests, probes or freeze. Registration as the native agent type is not verifiable from inside the instance.",
   "human_credentials_claimed": false,
   "independent_of_target_author": true
  },
  "target": {
   "project": "MyApp / Vilumo Fit",
   "artifact": "CoachingCore/r7/b1/RUNTIME_FREEZE_R7B1_2.json",
   "artifact_revision": "R7B1-FREEZE-2 (freeze commit 146ebb80c51d302ef3518a61c1cab208c7778632, bytes of f6525e7907680990ecbdbaf067c34fb0ec641d13; source digest f54e5c0345aa9c1dbd9743a78127b59720b3cf4d68c1b53ed11bfdbf40ed1612; manifest digest 980d830106f3c75722126a8c0bffb5e5aafa9a261b411c30a4779d6d3e08fae8; previous R7B1-FREEZE-1 d41df8b129495e32fe2923087d665798854609e9, source 976a13351f0b40ee363e9e4d6d1592e2653306ac018e3cf143d2d16968d366c9; predecessor R7B-RUNTIME-REPERTOIRE-FREEZE-2 10b26d6e40542a066f7f100fbf16060b66e15aee; policy R6-POLICY-5 18ec48f34768a7eebb2aede618db65a77385efebbda0a38d6f03135e5cd96b4c; catalog R7B0-CATALOG-2 ceee276a424ee7575b4477a2bc429de2e8cd854e3cb82ac767776492cdcb92f9; B0 r2 records 6867d3e89ebd4bb309c018fb456508d3a4510038194269769b0a4ef16f23d885)",
   "sha256": "e75a2799ae1b9387e7c8831646cb877967262c19aa11c18c8d54c2a7b94f27d5",
   "rule_ids": [
    "R6-POLICY-5 envelope records (r12): R6-EVENT-TRANSITION C7 and C18, R6-SUBSTITUTION C5, C6 and C8",
    "R7B0-SSCTR-r2 B0-C05 c1, B0-C06 c1 and c8, B0-C07 c1, B0-C09",
    "Correction cycle R7B1-FREEZE-1 d41df8b -> R7B1-FREEZE-2 146ebb8: src/r6-program.mjs (strengthRowsFor guard on every row, eventWeekStandIn lineage, buildWeek records), src/r6-adaptation.mjs (evaluateProgram clinical-first and unknown choices, skillMismatchGap with acceptGap, exerciseSubstitution attempt and nameable, slipsFrom week of next use, newEventStandIns)",
    "C1 QE-R7B1-01, C2 QR7B1-01, C3 QR7B1-02 with R7B1-SSCTR-F11, C4 QR7B1-03, C5 QR7B1-04 with R7B1-SSCTR-F12, C6 QR7B1-05",
    "CoachingCore/r7/b1/BLOCKER_CLOSURE_R7B1.md section Correction cycle (SHA-256 6c61137c...7ba15c)"
   ]
  },
  "question": "Narrow recheck on R7B1-FREEZE-2: is R7B1-SSCTR-F11 resolved by the event-week rule for every row, are the stand-in doses and the event-week sessions left out acceptable, may a no-lower-skill gap after a SKILL_MISMATCH be resolved by leaving the slot out, does the clinical screen come before any block-choice question, does a review that keeps an event-week slot out disclose it, and does the delta regress any dose? A runtime-binding check, not a new approval of the envelopes.",
  "population_context": {
   "population": "Explicitly nonclinical eligible adults (18+) of the V1 shadow-reference population of R6-POLICY-5: recreational novice-to-experienced runners and strength trainees, run-only, strength-only and hybrid; synthetic intakes under the development authority fixture; no real athlete, plan or runtime effect.",
   "eligibility_status": "SCOPE_DEFINITION_ONLY",
   "facts": [
    "Frozen bytes judged read-only: node scripts/verify-r7b1.mjs --tests from CoachingCore/ (R7B1-FREEZE-2 is the default) returned 25/25 PASS before the recheck (786 tests, 0 failed; source digest f54e5c03...ed1612, manifest digest 980d8301...08fae8, record e75a2799...4f27d5); the after-recheck run is recorded in SSCTR_RECHECK_R7B1.md. HEAD ea940df on claude/domain-coaching-r7-b1; this recheck changed no tracked file.",
    "Narrow scope (reviews/SSCTR_RECHECK_REQUEST.md, SHA-256 33232659...617ba15c): the correction cycle C1-C6 of CoachingCore/r7/b1/BLOCKER_CLOSURE_R7B1.md (SHA-256 6c61137c...7ba15c): the event-week rule for every row with R7B1-SSCTR-F11 (C3), leaving the slot out after a SKILL_MISMATCH (C2), the clinical screen before block-choice questions (C1), disclosure (C5, the review half of R7B1-SSCTR-F12), and dose regressions from the delta. Areas the delta does not touch are not re-reviewed.",
    "Comparator: a git archive mirror of R7B1-FREEZE-1 (d41df8b) outside the repository, whose 112 bound files match RUNTIME_FREEZE_R7B1_1.json. Every probe ran on both trees, read-only and synthetic (reviews/ssctr/recheck/probes/, outputs in probes/out/R7B1-F2 and probes/out/R7B1-F1). The temporary mirrors were deleted after the recheck.",
    "Blocking criterion (unchanged): a finding blocks when the runtime prescribes outside every approved envelope (R6, B0, R7-A); a deviation from a stricter rule whose prescription stays inside an approved envelope is recorded with an owner and does not block. Loop bound: this is the one recheck; any finding it raises is routed, not corrected.",
    "The 20 R7-B SSCTR recheck probes on both R7-B.1 freezes: 19 byte-identical (p10-p14, p16, p20, p31, p40, p41, p43, r01-r08); p42 differs only where the every-row rule removes first exposures planned on event days at intake (calf weeks 10,526 -> 10,525; single bent-knee calf weeks 570 -> 566).",
    "Reason-based substitution grid (s01, unchanged probe, 436 decisions): decision lines byte-identical on both R7-B.1 freezes (0 never-performed rows on 2,233 event days, 9 stand-ins, 428 slots left out, 241 establishments after the event); decisions carrying an event-week disclosure 166 -> 169, the three extra being knock-on slots of a substitution now disclosed (s12). The 68 decisions taken in the last SPECIFIC week still carry no decision-time disclosure (F12, decision half).",
    "Equipment path (s02 v2; 3 athletes x permanent kettlebell-only, bodyweight-only and bands-only, and dated bodyweight windows): never-performed rows on event-phase days 94 (R7B1-FREEZE-1) -> 0; 76 slots left out, no stand-in available because no performed configuration fits the new equipment; 24 race-week or post-event sessions that held one light session (1 set per MAIN lift) in the no-change plan become rest by design; 0 rows below the phase RIR minimum; all 15 decisions disclose the event-week handling (R7B1-FREEZE-1: 0).",
    "Stand-in doses (s03, rotation athletes): byte-identical on both R7-B.1 freezes; 9 stand-in rows, none above their own last sets or load, the replaced row or the counterfactual week.",
    "Rows no substitution placed (s09): an athlete who skipped every day-4 strength session, and one who skipped every strength session, got 19 never-performed first exposures in their planned taper, race-week and post-event sessions on R7B1-FREEZE-1; on R7B1-FREEZE-2 those slots are left out (3) or the whole session is rest by design (4). Short-horizon intakes (race 12-26 days after the start) and rebuilds at the taper (2 -> 3 strength days, a strength goal change) are identical on both freezes and bring nothing new.",
    "Intake programs (s11, s14; 2,560 programs, 10K and half marathon, 4 goals x 4 equipment sets x 4 day counts x 5 session lengths x 2 experiences x 2 rotations): R7B1-FREEZE-1 planned 222 first exposures on event-phase days (40 effort-established, 182 bodyweight) in 144 programs, mostly short sessions whose time fit had dropped those rows earlier; R7B1-FREEZE-2 plans none (58 performed stand-ins, 164 slots left out). 216 of 26,880 event-phase strength sessions change; none gains a set (184 equal, 32 lower); event-week sets 53,320 -> 53,288; live event sessions 14,080 on both.",
    "Clinical screen (s08; an event athlete at a block boundary and mid-block, a graduation runner; pain with an exercise, a clinical text, an illness interruption; ladder, main-change, graduation and unrecognised choices; with and without a correction): R7B1-FREEZE-2 routes 70 of 70 to CLINICAL_HUMAN_REQUIRED with no proposal and the dependency carried (R7B1-FREEZE-1: 0 of 70, all asked about the block choice, 28 with a proposal); nonclinical controls with a choice off the boundary still ask and propose nothing.",
    "No-lower-skill gap after a SKILL_MISMATCH (s10, the s05 part B grid): 36 questions, each offering exactly 'Keep the equipment' and 'Leave the pull slot out until the equipment returns' with no proposal until answered (R7B1-FREEZE-1: 'Name a pull exercise', which had no effect); confirming applies in 36 of 36 (R7B1-FREEZE-1: 0 of 36); 0 climbs at slot level (s05 part B); after a dated window the substitute returns in 18 of 18; in 6 of 18 permanent confirmed losses (all 2-day programs) no pull exercise remains in weeks 4-7.",
    "Strength grid (s05): byte-identical on both R7-B.1 freezes except the options of the 36 no-lower-skill questions; 0 climbs in 216 substitution decisions and 52 equipment losses after a SKILL_MISMATCH.",
    "Disclosure (s04, s13): a weekly review that keeps an event-week slot out of the plan, or fills it with a stand-in, now says so (6 of 6 missed cases, e.g. 'bulgarian-split-squat-db, not yet done in this program, is left out of w10-str-d4; it starts after the post-event week'), and returns nothing when the substitute was done; the decision taken in the last SPECIFIC week is unchanged (no disclosure).",
    "The author's adversarial probe, copied unchanged and run from this folder on R7B1-FREEZE-2: 3,228 checks, 0 failed, results identical to the author's adversarial-R7B1-2.json; its inherited equipment-change observation now finds no configuration new to the event weeks (12 rows on R7B1-FREEZE-1)."
   ],
   "unknowns": [